{
  "session_id": "SESSION_20260111_150000_abc12345",
  "created_at": "2026-01-11T15:00:00Z",
  "song": {
    "file_path": "/home/mark/Music/example_song.mp3",
    "title": "Moonlight Sonata",
    "artist": "Beethoven",
    "duration_seconds": 185.5,
    "bpm": 72,
    "time_signature": "4/4",
    "key": "C#m",
    "event_spine_path": "/home/mark/.roxy/theater-sessions/spines/moonlight_spine.json"
  },
  "recording": {
    "mode": "dual",
    "outputs": {
      "landscape": {
        "resolution": "3840x2160",
        "ndi_source": "MindSong Landscape 8K"
      },
      "portrait": {
        "resolution": "1080x1920",
        "ndi_source": "MindSong Portrait 4K"
      }
    },
    "pre_roll_seconds": 2,
    "post_roll_seconds": 2
  },
  "theater": {
    "preset": "performance",
    "widgets": [
      {
        "id": "piano-main",
        "type": "Piano",
        "visible": true,
        "position": { "x": 0.1, "y": 0.6 },
        "size": { "width": 0.8, "height": 0.35 }
      },
      {
        "id": "braid-viz",
        "type": "Braid",
        "visible": true,
        "position": { "x": 0.3, "y": 0.1 },
        "size": { "width": 0.4, "height": 0.45 }
      }
    ],
    "camera_automation": [
      {
        "trigger": "section_change",
        "trigger_value": "verse",
        "camera_preset": "wide"
      },
      {
        "trigger": "section_change",
        "trigger_value": "chorus",
        "camera_preset": "closeup_piano"
      }
    ]
  },
  "skybeam": {
    "auto_ingest": true,
    "job_type": "shorts",
    "metadata": {
      "title_template": "{song_title} - Visual Performance",
      "description_template": "Watch {song_title} by {artist} visualized in MindSong 8K Theater",
      "tags": ["music", "visualization", "piano", "classical"]
    }
  },
  "status": "pending"
}
